{
  "title": "Pip's Garden",
  "theme": "graph",
  "screens": 2,
  "band": "easy",
  "kid_summary": "Walk around the garden from above and find five stars.",
  "safety_ok": true,
  "sections": [
    {
      "role": "teach",
      "beats": [
        {
          "kind": "flat",
          "length": 20,
          "enemy": "none",
          "coins": 0,
          "spikes": "none"
        },
        {
          "kind": "flat",
          "length": 20,
          "enemy": "none",
          "coins": 0,
          "spikes": "none"
        },
        {
          "kind": "flat",
          "length": 20,
          "enemy": "none",
          "coins": 0,
          "spikes": "none"
        },
        {
          "kind": "flat",
          "length": 20,
          "enemy": "none",
          "coins": 0,
          "spikes": "none"
        },
        {
          "kind": "flat",
          "length": 8,
          "enemy": "none",
          "coins": 0,
          "spikes": "none"
        },
        {
          "kind": "goal",
          "style": "flag"
        }
      ]
    }
  ]
}
