{
  "title": "Ghost Manor",
  "theme": "notebook",
  "screens": 2,
  "band": "easy",
  "kid_summary": "Tap to flap through the gaps in the old manor.",
  "safety_ok": true,
  "sections": [
    {
      "role": "teach",
      "beats": [
        {
          "kind": "flat",
          "length": 20,
          "enemy": "none",
          "coins": 0,
          "spikes": "none"
        },
        {
          "kind": "flat",
          "length": 20,
          "enemy": "none",
          "coins": 0,
          "spikes": "none"
        },
        {
          "kind": "flat",
          "length": 20,
          "enemy": "none",
          "coins": 0,
          "spikes": "none"
        },
        {
          "kind": "flat",
          "length": 20,
          "enemy": "none",
          "coins": 0,
          "spikes": "none"
        },
        {
          "kind": "flat",
          "length": 8,
          "enemy": "none",
          "coins": 0,
          "spikes": "none"
        },
        {
          "kind": "goal",
          "style": "flag"
        }
      ]
    }
  ]
}
